{"id":"ritual:weighing-of-the-heart","title":"The Weighing of the Heart","tradition":"Ancient Egyptian religion (New Kingdom, Book of the Dead, Spell 125); no continuous living community","chapter":"chapter:ch02","museum_object":"relic:v20","sensitivity_tier":2,"framing_approval":{"by":"Carter","date":"2026-10-11","record":"Approved with plans/games-modern.md §5 (the prototype: the Weighing of the Heart, Egypt room) on 2026-10-11; listed in plans/rituals-tiers.md"},"framing":"guided, explanatory, no scores or win states","opt_in":true,"intro":"Five steps through the judgment scene of the Papyrus of Ani, as the papyrus shows it: Ani's judgment, not yours. The camera turns to each part of the museum's rendition of the scene (not a photograph). Nothing here depends on you.","sources":[{"id":"budge-1895-ch125-title","cite":"E. A. Wallis Budge, The Book of the Dead: The Papyrus of Ani (British Museum, 1895), Plates XXIX and XXX: the opening of Chapter CXXV (Spell 125)","url":"https://sacred-texts.com/book/the-book-of-the-dead/plates-xxix-and-xxx","checked":"read 2026-10-11 through a web-fetch tool (direct download blocked from the build sandbox); the chapter title quoted exactly; re-read against the page at review"},{"id":"budge-1895-confession","cite":"E. A. Wallis Budge, The Book of the Dead: The Papyrus of Ani (British Museum, 1895), Plates XXXI and XXXII: the Negative Confession","url":"https://sacred-texts.com/book/the-book-of-the-dead/plates-xxxi-and-xxxii","checked":"read 2026-10-11 through a web-fetch tool (direct download blocked from the build sandbox); the seven declarations requested exactly in two separate fetches, same wording both times; re-read against the page at review"},{"id":"budge-1895-plate-iii","cite":"E. A. Wallis Budge, The Book of the Dead: The Papyrus of Ani (British Museum, 1895), Plate III: the weighing of the heart","url":"https://sacred-texts.com/book/the-book-of-the-dead/plate-iii","checked":"read 2026-10-11 through a web-fetch tool (direct download blocked from the build sandbox); quotations requested exactly; re-read against the page at review"},{"id":"budge-1895-plate-iv","cite":"E. A. Wallis Budge, The Book of the Dead: The Papyrus of Ani (British Museum, 1895), Plate IV: Ani led to Osiris","url":"https://sacred-texts.com/book/the-book-of-the-dead/plate-iv","checked":"read 2026-10-11 through a web-fetch tool (direct download blocked from the build sandbox); quotations requested exactly; re-read against the page at review"},{"id":"bm-ea10470-3","cite":"British Museum, the Papyrus of Ani, sheet 3 (EA 10470/3): collection record","url":"https://www.britishmuseum.org/collection/object/Y_EA10470-3","checked":"read 2026-10-11 through a web-fetch tool; the description quoted exactly; re-read at review"},{"id":"bm-ea10470-4","cite":"British Museum, the Papyrus of Ani, sheet 4 (EA 10470/4): collection record","url":"https://www.britishmuseum.org/collection/object/Y_EA10470-4","checked":"read 2026-10-11 through a web-fetch tool; the description quoted exactly; re-read at review"},{"id":"vault-v20","cite":"The Divine Archives, Vault entry V20: The Papyrus of Ani (its own sources in sources/v20-papyrus-of-ani.md)","url":"https://getconexto.com/vault/papyrus-of-ani.html","checked":"the archive's own page, 2026-10-11"}],"steps":[{"sequence_order":1,"pacing_duration_ms":0,"input_trigger_type":"tap","historical_text_anchor_id":"section:ch02/a-heart-on-the-scales","source_ids":["budge-1895-ch125-title","budge-1895-plate-iii","bm-ea10470-3"],"text":"The Hall of the Two Truths. Egyptians believed that after death a person came before the gods to be judged. In Budge's translation Spell 125 is the chapter of entering into the Hall of Double Right and Truth, the hall now usually called the Hall of the Two Truths. Here the scribe Ani and his wife Tutu enter, bent forward in humility; above them twelve gods sit on thrones as the judges.","pacing_note":"No wait: the visitor moves on when ready."},{"sequence_order":2,"pacing_duration_ms":0,"input_trigger_type":"tap","historical_text_anchor_id":"section:ch02/law-and-the-moral-order-maat","source_ids":["budge-1895-confession"],"text":"The Declaration of Innocence. Egyptians believed the dead had to declare their innocence before forty-two divine judges, naming each one and denying one wrong to each. These are seven of Ani's forty-two declarations, in Budge's translation of 1895 (his numbers 2, 3, 4, 8, 12, 13 and 19). They are Ani's words: you are only reading them.\n“Hail, thou who art embraced by flame, who comest forth from Kheraba, I have not robbed with violence.”\n“Hail, Fentiu, who comest forth from Khemennu, I have not stolen.”\n“Hail, Devourer of the Shade, who comest forth from Qernet, I have done no murder; I have done no harm.”\n“Hail, thou Flame, which comest and goest, I have spoken no lies.”\n“Hail, thou whose face is turned back, who comest forth from thy hiding place, I have not caused shedding of tears.”\n“Hail, Bast, who comest forth from the secret place, I have not dealt deceitfully.”\n“Hail, Sertiu, who comest forth from Annu, I have not been angry and wrathful except for a just cause.”","pacing_note":"No wait: the visitor moves on when ready."},{"sequence_order":3,"pacing_duration_ms":0,"input_trigger_type":"tap","historical_text_anchor_id":"section:ch02/a-heart-on-the-scales","source_ids":["budge-1895-plate-iii","bm-ea10470-3","vault-v20"],"text":"The scales. Egyptians believed the heart, the seat of thought and memory, was weighed against the feather of Ma'at: truth and right order. The jackal-headed Anubis tests the balance. The papyrus shows Ani's heart and the feather in balance, and in its text Thoth reports that the heart “hath been found true by trial in the Great Balance.”","pacing_note":"No wait: the visitor moves on when ready."},{"sequence_order":4,"pacing_duration_ms":0,"input_trigger_type":"tap","historical_text_anchor_id":"section:ch02/a-heart-on-the-scales","source_ids":["bm-ea10470-3","budge-1895-plate-iii"],"text":"Thoth records; Ammit waits. The ibis-headed Thoth, scribe of the gods, writes down the result. Behind him sits Ammit, the Devourer, with the head of a crocodile, the forepart of a lion and the hindquarters of a hippopotamus, “ready to spring forward to consume Ani's heart if he fails to pass the test” (the British Museum's description). Egyptians believed that a heart which failed would be consumed. The papyrus does not show that happening, and neither does this walkthrough: in its text the gods answer, “Let it not be given to the devourer Amemet to prevail over him.”","pacing_note":"No wait: the visitor moves on when ready."},{"sequence_order":5,"pacing_duration_ms":0,"input_trigger_type":"tap","historical_text_anchor_id":"section:ch02/cosmology-and-the-gods","source_ids":["budge-1895-plate-iv","bm-ea10470-4","vault-v20"],"text":"Horus presents Ani to Osiris. Found true, Ani is taken by the hand by the falcon-headed Horus, son of Isis, and led to Osiris, ruler of the dead, enthroned in a shrine with Isis and Nephthys behind him. Egyptians believed the justified dead passed on into the realm of Osiris. Horus says: “I have come unto thee, O Unnefer, and I have brought the Osiris Ani unto thee.”","pacing_note":"No wait: the visitor moves on when ready."}],"review":{"status":"pending","notes":"New content, shown with the pending-review tag until Carter clears it. Every quotation is logged in sources/ritual-weighing-of-the-heart.md; the sources were read through a fetch tool and must be re-read at review."}}
